pair,acronym,description,frequency
"('PEG', 'para su edad gestacional')",PEG,para su edad gestacional,1
"('BPT', 'bajo peso a término')",BPT,bajo peso a término,1
"('LVQOL', 'low vision quality of life')",LVQOL,low vision quality of life,1
"('IB', 'intervención breve')",IB,intervención breve,1
"('PPT', 'partos pretérmino')",PPT,partos pretérmino,1
"('ABP', 'aprendizaje basado en problemas')",ABP,aprendizaje basado en problemas,1
"('PAC', 'porcentaje anual de cambio')",PAC,porcentaje anual de cambio,1
"('ADHD-RS', 'adhd rating scale')",ADHD-RS,adhd rating scale,1
